{
  "task_id": "abc123",
  "task_display_name": "example-name",
  "owner": "example-value",
  "start_date": "example-value",
  "end_date": "example-value",
  "trigger_rule": "example-value",
  "depends_on_past": true,
  "wait_for_downstream": true,
  "retries": "example-value",
  "queue": "example-value",
  "pool": "example-value",
  "pool_slots": "example-value",
  "execution_timeout": "example-value",
  "retry_delay": "example-value",
  "retry_exponential_backoff": 1,
  "priority_weight": "example-value",
  "weight_rule": "example-value",
  "ui_color": "example-value",
  "ui_fgcolor": "example-value",
  "template_fields": "example-value",
  "downstream_task_ids": "abc123",
  "doc_md": "example-value",
  "operator_name": "example-name",
  "params": "example-value",
  "class_ref": "example-value",
  "is_mapped": "example-value",
  "extra_links": []
}